{
  "format": "ac-umtc",
  "version": "0.1",
  "encoding": "float",
  "number_field": "cyclotomic(8)",
  "category_type": "umtc",
  "_meta": {
    "note": "Minimal UMTC output placeholder for schema v0"
  },
  "objects": [
    "1",
    "e",
    "m",
    "em"
  ],
  "qdim": {
    "1": 1.0,
    "e": 1.0,
    "m": 1.0,
    "em": 1.0
  },
  "global_dim": 4.0,
  "twist": {
    "1": 1.0,
    "e": 1.0,
    "m": 1.0,
    "em": -1.0
  },
  "S": [
    [
      0.5,
      0.5,
      0.5,
      0.5
    ],
    [
      0.5,
      0.5,
      -0.5,
      -0.5
    ],
    [
      0.5,
      -0.5,
      0.5,
      -0.5
    ],
    [
      0.5,
      -0.5,
      -0.5,
      0.5
    ]
  ],
  "T": [
    [
      1.0,
      0.0,
      0.0,
      0.0
    ],
    [
      0.0,
      1.0,
      0.0,
      0.0
    ],
    [
      0.0,
      0.0,
      1.0,
      0.0
    ],
    [
      0.0,
      0.0,
      0.0,
      -1.0
    ]
  ],
  "checks": {
    "note": "v0: content unconstrained"
  },
  "hashes": {
    "placeholder": "sha256:deadbeef"
  },
  "provenance": {
    "generated_by": "ac 0.1.0-dev",
    "date": "2025-10-03T09:12:12Z",
    "toolchain_version": "py3.12|ruff0.13.3|mypy1.18.2",
    "exact_backend_id": null,
    "numeric_policy": null,
    "sources": [
      "tests/examples/toric_umtc_input.min.json"
    ]
  }
}
